<?xml>
<xs:schema>
  <xs:element name="Customers">
    <xs:complexType>

        <xs:element name="Customer" maxOccurs="unbounded">
          <xs:complexType>
              <xs:element name="ID" type="xs:string"/>
              <xs:element name="Name" type="xs:string"/>
              <xs:element name="Address">
                <xs:complexType>
                    <xs:element name="Street" type="xs:string"/>
                    <xs:element name="Zip" type="xs:string"/>                
                </xs:complexType>
              </xs:element>
              <xs:element name="DateOfBirth" type="xs:date"/>
              <xs:element name="TelephoneNumber">
                <xs:complexType>
                    <xs:element name="WorkNumber" type="xs:string"/>
                    <xs:element name="MobileNumber" type="xs:string"/>
                </xs:complexType>
              </xs:element>
          </xs:complexType>
        </xs:element>
    </xs:complexType>
  </xs:element>
</xs:schema>
